Form-trading-bot,rhys1332/Form-trading-bot,https://github.com/rhys1332/Form-trading-bot,"Form Trading Bot is an advanced algorithmic trading system designed to automate and optimize your trading strategies across multiple financial markets. Leveraging cutting-edge AI and quantitative analysis, it executes trades with precision and speed unmatched by manual trading.",1,2025-10-10T16:23:28Z,0,53,False,0,,2,1.0,False,False,False,https://api.github.com/repos/rhys1332/Form-trading-bot/contributors,https://api.github.com/repos/rhys1332/Form-trading-bot/collaborators{/collaborator},1,edge ai
amazon-sagemaker-edge-defect-detection-computer-vision,aws-samples/amazon-sagemaker-edge-defect-detection-computer-vision,https://github.com/aws-samples/amazon-sagemaker-edge-defect-detection-computer-vision,Workshop showcasing how to run defect detection using computer vision at the edge with Amazon SageMaker,50,2025-06-17T03:58:53Z,7,52,False,21,Python,2779,1.0,False,False,False,https://api.github.com/repos/aws-samples/amazon-sagemaker-edge-defect-detection-computer-vision/contributors,https://api.github.com/repos/aws-samples/amazon-sagemaker-edge-defect-detection-computer-vision/collaborators{/collaborator},4,edge ai
aionair,deepsingh132/aionair,https://github.com/deepsingh132/aionair,"A cutting-edge AI SaaS platform that enables users to create, discover, and enjoy podcasts with advanced features like text-to-audio conversion with multi-voice AI, podcast thumbnail image generation, and seamless playback. The platform is built using Next.js, TypeScript, Convex, OpenAI, Stripe, Clerk, ShadCN, and Tailwind CSS.",58,2025-03-19T22:34:29Z,57,50,False,15,TypeScript,14241,1.0,False,False,False,https://api.github.com/repos/deepsingh132/aionair/contributors,https://api.github.com/repos/deepsingh132/aionair/collaborators{/collaborator},1,edge ai
executorch-rs,barakugav/executorch-rs,https://github.com/barakugav/executorch-rs,"Rust bindings for ExecuTorch - On-device AI across mobile, embedded and edge for PyTorch",109,2025-11-12T12:19:33Z,40,50,False,2,Rust,1326,1.0,False,False,False,https://api.github.com/repos/barakugav/executorch-rs/contributors,https://api.github.com/repos/barakugav/executorch-rs/collaborators{/collaborator},2,edge ai
pager-frontend,HeroTools/pager-frontend,https://github.com/HeroTools/pager-frontend,"Open-source team collaboration where your conversations become your competitive edge. AI-powered, privacy-first, and you control every bit of it.",360,2025-09-11T05:58:26Z,0,49,False,9,TypeScript,1998,1.0,False,False,False,https://api.github.com/repos/HeroTools/pager-frontend/contributors,https://api.github.com/repos/HeroTools/pager-frontend/collaborators{/collaborator},2,edge ai
Awesome-Agent-RL,tongjingqi/Awesome-Agent-RL,https://github.com/tongjingqi/Awesome-Agent-RL,"A curated list of awesome resources about reward construction for AI agents. This repository covers cutting-edge research, and practical guides on defining and collecting rewards to build more intelligent and aligned AI agents.",103,2025-09-01T11:33:22Z,0,49,False,0,,1146,1.0,False,False,False,https://api.github.com/repos/tongjingqi/Awesome-Agent-RL/contributors,https://api.github.com/repos/tongjingqi/Awesome-Agent-RL/collaborators{/collaborator},4,edge ai
Finance_AgenticAI,shivamim/Finance_AgenticAI,https://github.com/shivamim/Finance_AgenticAI,"Financial Agentic AI redefines financial analysis by integrating cutting-edge AI with real-time web search capabilities. This multi-agent system brings together financial insights and web intelligence to deliver precise, actionable, and up-to-date stock market information, all tailored to your needs.",17,2024-12-28T20:08:54Z,17,46,False,25,Python,46,1.0,False,False,False,https://api.github.com/repos/shivamim/Finance_AgenticAI/contributors,https://api.github.com/repos/shivamim/Finance_AgenticAI/collaborators{/collaborator},1,edge ai
TEG-Benchmark,Zhuofeng-Li/TEG-Benchmark,https://github.com/Zhuofeng-Li/TEG-Benchmark,[NeurIPS 2024 🔥] TEG-DB: A Comprehensive Dataset and Benchmark of Textual-Edge Graphs,29,2025-01-15T02:32:13Z,28,44,False,2,Python,1033,1.0,False,False,False,https://api.github.com/repos/Zhuofeng-Li/TEG-Benchmark/contributors,https://api.github.com/repos/Zhuofeng-Li/TEG-Benchmark/collaborators{/collaborator},1,edge ai
cybernetic,tr1bunal9/cybernetic,https://github.com/tr1bunal9/cybernetic,"Cybernetic is a cutting-edge AI-driven platform that enhances human-machine collaboration. It integrates advanced automation, data analytics, and neural interfaces to optimize decision-making and performance. Designed for innovation, Cybernetic bridges the gap between technology and human potential.",0,2025-02-07T14:32:40Z,0,44,False,0,,0,1.0,False,False,False,https://api.github.com/repos/tr1bunal9/cybernetic/contributors,https://api.github.com/repos/tr1bunal9/cybernetic/collaborators{/collaborator},0,edge ai
ariel,google-marketing-solutions/ariel,https://github.com/google-marketing-solutions/ariel,A cutting-edge AI dubbing solution designed to enhance the global reach of digital advertising.,154,2025-11-14T21:51:54Z,139,43,False,19,Python,2395,1.0,False,False,False,https://api.github.com/repos/google-marketing-solutions/ariel/contributors,https://api.github.com/repos/google-marketing-solutions/ariel/collaborators{/collaborator},7,edge ai
AISonobuoy,IQTLabs/AISonobuoy,https://github.com/IQTLabs/AISonobuoy,Maritime Situational Awareness: An Exploration,2425,2025-06-10T01:57:09Z,0,43,False,21,C,88582,1.0,False,True,False,https://api.github.com/repos/IQTLabs/AISonobuoy/contributors,https://api.github.com/repos/IQTLabs/AISonobuoy/collaborators{/collaborator},18,edge ai
The-AiEdge-Code-Examples,damienbenveniste/The-AiEdge-Code-Examples,https://github.com/damienbenveniste/The-AiEdge-Code-Examples,,31,2025-08-11T06:01:52Z,19,42,False,23,Jupyter Notebook,3360,1.0,False,False,False,https://api.github.com/repos/damienbenveniste/The-AiEdge-Code-Examples/contributors,https://api.github.com/repos/damienbenveniste/The-AiEdge-Code-Examples/collaborators{/collaborator},1,edge ai
DocMagic,Muneerali199/DocMagic,https://github.com/Muneerali199/DocMagic,"DocMagic is a 100% open source, cutting-edge AI-powered document creation platform that revolutionizes how professionals create stunning documents. Built by the community, for the community - simply describe what you need, and watch as our advanced AI transforms your ideas into polished resumes, captivating presentations, comprehensive CVs, and pro",788,2025-11-12T17:31:17Z,0,40,False,127,TypeScript,114510,1.0,False,False,False,https://api.github.com/repos/Muneerali199/DocMagic/contributors,https://api.github.com/repos/Muneerali199/DocMagic/collaborators{/collaborator},53,edge ai
Writora-AI,anayatkhan1/Writora-AI,https://github.com/anayatkhan1/Writora-AI,"Writora AI is a powerful tool that transforms your video or audio content into a blog post in seconds, powered by cutting-edge AI technology.",27,2025-10-23T14:40:07Z,22,39,False,12,TypeScript,5547,1.0,False,False,False,https://api.github.com/repos/anayatkhan1/Writora-AI/contributors,https://api.github.com/repos/anayatkhan1/Writora-AI/collaborators{/collaborator},1,edge ai
Swift-Executor,mugiwaraDr/Swift-Executor,https://github.com/mugiwaraDr/Swift-Executor,"🌊 Swift Executor is a cutting-edge script executor for Windows, built with Roblox players in mind. Featuring smart AI assistance for easy script writing, a premium ad-free environment, and round-the-clock support, Swift offers a flawless experience that transforms the way you play.",6,2025-04-07T19:30:22Z,4,39,False,0,,91,1.0,False,False,False,https://api.github.com/repos/mugiwaraDr/Swift-Executor/contributors,https://api.github.com/repos/mugiwaraDr/Swift-Executor/collaborators{/collaborator},1,edge ai
learnJetson,osnava/learnJetson,https://github.com/osnava/learnJetson,Learning to use this device. You'll find edge AI applications and useful commands to optimize your Jetson,37,2025-11-05T17:57:48Z,0,38,False,3,Python,317440,1.0,False,False,False,https://api.github.com/repos/osnava/learnJetson/contributors,https://api.github.com/repos/osnava/learnJetson/collaborators{/collaborator},3,edge ai
Thunder-Executor,SrikanthMoreboina/Thunder-Executor,https://github.com/SrikanthMoreboina/Thunder-Executor,"🌊 Thunder Executor is a cutting-edge script executor for Windows, built with Roblox players in mind. Featuring smart AI assistance for easy script writing, a premium ad-free environment, and round-the-clock support, Thunder offers a flawless experience that transforms the way you play.",7,2025-04-08T16:36:29Z,5,38,False,0,CSS,303,1.0,False,False,False,https://api.github.com/repos/SrikanthMoreboina/Thunder-Executor/contributors,https://api.github.com/repos/SrikanthMoreboina/Thunder-Executor/collaborators{/collaborator},1,edge ai
Nihon-Executor,manasroutcse/Nihon-Executor,https://github.com/manasroutcse/Nihon-Executor,"🌊 Nihon Executor is a cutting-edge script executor for Windows, built with Roblox players in mind. Featuring smart AI assistance for easy script writing, a premium ad-free environment, and round-the-clock support, Nihon offers a flawless experience that transforms the way you play.",2,2025-04-07T19:27:01Z,0,37,False,0,,56,1.0,False,False,False,https://api.github.com/repos/manasroutcse/Nihon-Executor/contributors,https://api.github.com/repos/manasroutcse/Nihon-Executor/collaborators{/collaborator},1,edge ai
ai-sdk-flags-edge-config,vercel-labs/ai-sdk-flags-edge-config,https://github.com/vercel-labs/ai-sdk-flags-edge-config,Example project showing how you can use Edge Config and Feature Flags with the Vercel AI SDK,26,2024-12-20T18:04:33Z,26,36,False,7,TypeScript,196,1.0,False,False,False,https://api.github.com/repos/vercel-labs/ai-sdk-flags-edge-config/contributors,https://api.github.com/repos/vercel-labs/ai-sdk-flags-edge-config/collaborators{/collaborator},1,edge ai
RagUltimateAdvisor,dev-it-with-me/RagUltimateAdvisor,https://github.com/dev-it-with-me/RagUltimateAdvisor,A complete Retrieval-Augmented Generation (RAG) application that demonstrates modern AI capabilities for answering questions about Ultimate Frisbee rules and strategies. This project showcases how to build a production-ready RAG system using cutting-edge technologies.,23,2025-10-24T10:25:14Z,0,35,False,18,Python,318,1.0,False,False,False,https://api.github.com/repos/dev-it-with-me/RagUltimateAdvisor/contributors,https://api.github.com/repos/dev-it-with-me/RagUltimateAdvisor/collaborators{/collaborator},1,edge ai
qllm,quantalogic/qllm,https://github.com/quantalogic/qllm,"QLLM: A powerful CLI for seamless interaction with multiple Large Language Models. Simplify AI workflows, streamline development, and unlock the potential of cutting-edge language models.  ⭐ If you find QLLM useful, consider giving us a star on GitHub! It helps us reach more developers and improve the tool. ⭐",449,2025-04-11T14:42:51Z,427,34,False,8,TypeScript,2600,1.0,False,False,False,https://api.github.com/repos/quantalogic/qllm/contributors,https://api.github.com/repos/quantalogic/qllm/collaborators{/collaborator},4,edge ai
openvino_testdrive,openvinotoolkit/openvino_testdrive,https://github.com/openvinotoolkit/openvino_testdrive,"With OpenVINO Test Drive, users can run large language models (LLMs) and models trained by Intel Geti on their devices, including AI PCs and Edge devices.",603,2025-10-27T20:40:11Z,387,34,False,5,Dart,25317,1.0,False,False,False,https://api.github.com/repos/openvinotoolkit/openvino_testdrive/contributors,https://api.github.com/repos/openvinotoolkit/openvino_testdrive/collaborators{/collaborator},6,edge ai
Papers-Literature-ML-DL-RL-AI,rohanmistry231/Papers-Literature-ML-DL-RL-AI,https://github.com/rohanmistry231/Papers-Literature-ML-DL-RL-AI,"A curated collection of research papers and literature on machine learning, deep learning, reinforcement learning, and AI, with summaries and key insights. Serves as a resource for researchers and learners to explore cutting-edge advancements and foundational concepts.",2,2025-05-24T23:40:42Z,1,34,False,0,,498026,1.0,False,False,False,https://api.github.com/repos/rohanmistry231/Papers-Literature-ML-DL-RL-AI/contributors,https://api.github.com/repos/rohanmistry231/Papers-Literature-ML-DL-RL-AI/collaborators{/collaborator},1,edge ai
pdf.ai,Srijan-D/pdf.ai,https://github.com/Srijan-D/pdf.ai,"Edge compatible PDF.ai Chat with any PDF document You can ask questions, get summaries, find information, and more. Built with Pinecone, OpenAI, Langchain, Nextjs13, TypeScript, Clerk Auth, Drizzle ORM for edge runtime environment, Shadcn UI.",61,2025-06-27T16:07:26Z,2,33,False,14,TypeScript,420,1.0,False,False,False,https://api.github.com/repos/Srijan-D/pdf.ai/contributors,https://api.github.com/repos/Srijan-D/pdf.ai/collaborators{/collaborator},1,edge ai
awesome-solana-ai-hackathon,tkorkmazeth/awesome-solana-ai-hackathon,https://github.com/tkorkmazeth/awesome-solana-ai-hackathon,"Welcome to the Solana AI Agent Hackathon repository! This resource is your ultimate guide to creating, deploying, and managing autonomous AI agents powered by Solana and cutting-edge tools.",5,2024-12-19T13:31:47Z,5,33,False,9,,24,1.0,False,False,False,https://api.github.com/repos/tkorkmazeth/awesome-solana-ai-hackathon/contributors,https://api.github.com/repos/tkorkmazeth/awesome-solana-ai-hackathon/collaborators{/collaborator},2,edge ai
AI-penetration-testing,Mr-Infect/AI-penetration-testing,https://github.com/Mr-Infect/AI-penetration-testing," AI/ML/LLM Penetration Testing Toolkit by Mr-Infect — the #1 GitHub resource for AI security, red teaming, and adversarial ML techniques. This repository is dedicated to offensive and defensive security for cutting-edge AI, Machine Learning (ML), and Large Language Models (LLMs) like ChatGPT, Claude, and LLaMA.",21,2025-07-21T16:08:01Z,0,33,False,9,,8508,1.0,False,False,False,https://api.github.com/repos/Mr-Infect/AI-penetration-testing/contributors,https://api.github.com/repos/Mr-Infect/AI-penetration-testing/collaborators{/collaborator},1,edge ai
SPEAR,lfedgeai/SPEAR,https://github.com/lfedgeai/SPEAR,Distributed Cloud-Edge Collaborative AI Agent Platform,70,2025-11-07T02:13:30Z,6,32,False,9,Rust,2968,1.0,False,False,False,https://api.github.com/repos/lfedgeai/SPEAR/contributors,https://api.github.com/repos/lfedgeai/SPEAR/collaborators{/collaborator},4,edge ai
edge-ai-tuning-kit,open-edge-platform/edge-ai-tuning-kit,https://github.com/open-edge-platform/edge-ai-tuning-kit,"The Edge AI Tuning Kit is a comprehensive solution for creating, tailoring, and implementing AI models in the edge platform.",39,2025-11-07T18:29:13Z,0,32,False,4,TypeScript,10707,1.0,False,False,False,https://api.github.com/repos/open-edge-platform/edge-ai-tuning-kit/contributors,https://api.github.com/repos/open-edge-platform/edge-ai-tuning-kit/collaborators{/collaborator},2,edge ai
BeautifyOllama,zahintapadar/BeautifyOllama,https://github.com/zahintapadar/BeautifyOllama,"BeautifyOllama is an open-source web interface that enhances your local Ollama AI model interactions with a beautiful, modern design. Built with cutting-edge web technologies, it provides a seamless chat experience with stunning visual effects and enterprise-grade functionality.",44,2025-10-27T15:10:56Z,0,32,False,1,TypeScript,23217,1.0,False,False,False,https://api.github.com/repos/zahintapadar/BeautifyOllama/contributors,https://api.github.com/repos/zahintapadar/BeautifyOllama/collaborators{/collaborator},1,edge ai
edge2ai-workshop,cloudera-labs/edge2ai-workshop,https://github.com/cloudera-labs/edge2ai-workshop,,590,2025-09-08T15:08:43Z,89,31,False,37,Python,98105,1.0,False,False,False,https://api.github.com/repos/cloudera-labs/edge2ai-workshop/contributors,https://api.github.com/repos/cloudera-labs/edge2ai-workshop/collaborators{/collaborator},8,edge ai
edgeai-gst-apps,TexasInstruments/edgeai-gst-apps,https://github.com/TexasInstruments/edgeai-gst-apps,Gstreamer based Edge AI reference application,183,2025-11-10T17:57:24Z,43,31,False,40,C++,479,1.0,False,False,False,https://api.github.com/repos/TexasInstruments/edgeai-gst-apps/contributors,https://api.github.com/repos/TexasInstruments/edgeai-gst-apps/collaborators{/collaborator},13,edge ai
awesome-edge-AI-papers,withhaotian/awesome-edge-AI-papers,https://github.com/withhaotian/awesome-edge-AI-papers,A curated list of awesome edge AI computing / system research.,26,2024-12-12T06:25:06Z,26,31,False,3,,6414,1.0,False,False,False,https://api.github.com/repos/withhaotian/awesome-edge-AI-papers/contributors,https://api.github.com/repos/withhaotian/awesome-edge-AI-papers/collaborators{/collaborator},2,edge ai
self,watson-intu/self,https://github.com/watson-intu/self,Intu is a Cognitive Embodiment Middleware for AI on the edge.,66,2024-11-29T18:47:35Z,2,30,False,27,C++,160108,1.0,False,False,False,https://api.github.com/repos/watson-intu/self/contributors,https://api.github.com/repos/watson-intu/self/collaborators{/collaborator},7,edge ai
RPi-Pico-projects-for-schools,arm-university/RPi-Pico-projects-for-schools,https://github.com/arm-university/RPi-Pico-projects-for-schools,"Raspberry Pi Pico Projects for Schools:    Explore cutting-edge topics in Computing, including Machine Learning and Internet of Things. Ages 16-18. ",218,2025-06-13T09:30:11Z,1,30,False,9,Jupyter Notebook,116311,1.0,False,False,False,https://api.github.com/repos/arm-university/RPi-Pico-projects-for-schools/contributors,https://api.github.com/repos/arm-university/RPi-Pico-projects-for-schools/collaborators{/collaborator},5,edge ai
UNIFEI-IESTI05-EDGE_AI,Mjrovai/UNIFEI-IESTI05-EDGE_AI,https://github.com/Mjrovai/UNIFEI-IESTI05-EDGE_AI,Edge Machine Learning Systems Engineering,136,2025-11-05T20:10:00Z,0,29,False,6,Jupyter Notebook,148850,1.0,False,False,False,https://api.github.com/repos/Mjrovai/UNIFEI-IESTI05-EDGE_AI/contributors,https://api.github.com/repos/Mjrovai/UNIFEI-IESTI05-EDGE_AI/collaborators{/collaborator},1,edge ai
volant,volantvm/volant,https://github.com/volantvm/volant,Modular orchestration engine for microvms,413,2025-11-10T22:50:23Z,0,29,False,0,C,238403,1.0,False,False,False,https://api.github.com/repos/volantvm/volant/contributors,https://api.github.com/repos/volantvm/volant/collaborators{/collaborator},1,edge ai
ai-confluence,CodersHQ-AI-ML-Community/ai-confluence,https://github.com/CodersHQ-AI-ML-Community/ai-confluence,"A collaborative hub for AI enthusiasts and experts in the UAE to contribute and refine ideas under the Coders(HQ) initiative. Fork, innovate, and contribute as we merge cutting-edge solutions into the mainstream of AI and Machine Learning development.",93,2024-12-20T22:30:33Z,93,28,False,6,Jupyter Notebook,64340,1.0,False,False,False,https://api.github.com/repos/CodersHQ-AI-ML-Community/ai-confluence/contributors,https://api.github.com/repos/CodersHQ-AI-ML-Community/ai-confluence/collaborators{/collaborator},5,edge ai
hailo_tappas_ros2,kyrikakis/hailo_tappas_ros2,https://github.com/kyrikakis/hailo_tappas_ros2,Combining Hailo tappas and ROS2 in one package for AI on the edge,110,2025-04-03T16:11:31Z,0,28,False,3,Python,11124,1.0,False,False,False,https://api.github.com/repos/kyrikakis/hailo_tappas_ros2/contributors,https://api.github.com/repos/kyrikakis/hailo_tappas_ros2/collaborators{/collaborator},2,edge ai
ChatRPG,KarmaKamikaze/ChatRPG,https://github.com/KarmaKamikaze/ChatRPG,"Welcome to ChatRPG, where your journey into the world of fantasy is powered by cutting-edge AI.  Immerse yourself in endless possibilities, embark on epic adventures, and shape your own destiny  in this choose-your-own-adventure (CYOA) game.",491,2025-05-23T11:25:26Z,83,28,False,0,C#,13451,1.0,False,False,False,https://api.github.com/repos/KarmaKamikaze/ChatRPG/contributors,https://api.github.com/repos/KarmaKamikaze/ChatRPG/collaborators{/collaborator},4,edge ai
TheGradientPath,samugit83/TheGradientPath,https://github.com/samugit83/TheGradientPath,"TheGradientPath is your hands-on guide to ML and AI, mixing bite-sized Python scripts, notebooks, and videos. Start with fundamentals, climb to cutting-edge models, and learn by reading, coding, and watching. Fork the repo and join the journey.",36,2025-10-26T20:01:28Z,0,27,False,7,Python,194396,1.0,False,False,False,https://api.github.com/repos/samugit83/TheGradientPath/contributors,https://api.github.com/repos/samugit83/TheGradientPath/collaborators{/collaborator},0,edge ai
19-Gen-AI-Projects,rohanmistry231/19-Gen-AI-Projects,https://github.com/rohanmistry231/19-Gen-AI-Projects,"A collection of 19 generative AI projects in Python, showcasing applications in text generation, image synthesis, and chatbots using frameworks like Transformers and PyTorch. Includes datasets, code, and tutorials for building and deploying cutting-edge AI models.",23,2025-05-23T03:07:29Z,0,27,False,0,Jupyter Notebook,32878,1.0,False,False,False,https://api.github.com/repos/rohanmistry231/19-Gen-AI-Projects/contributors,https://api.github.com/repos/rohanmistry231/19-Gen-AI-Projects/collaborators{/collaborator},1,edge ai
Artificial-Intelligence,Hazrat-Ali9/Artificial-Intelligence,https://github.com/Hazrat-Ali9/Artificial-Intelligence,🤖 Artificial 👻 Intelligence 🙉 Toolbox 🤢 ultimate 🥶 open 🤡 source 🍎 suite 🍏 building 🌰 intelligent 🫑 systems 🥝 This 🍔 repository 🥬 brings 🏕 together 🕌 cutting 🏠 edge AI 🏪 models 🚂 powerful 🎳 algorithms 🏐 and hands ⚽ on tools 🥎machine ⛸ learning 🎮 deep 🚚 learning ✈ and 🚀 beyond 🛸 Automated 🚁 scripts 🚟 datasets ☂,4,2025-07-21T10:21:38Z,0,27,False,0,,2429,1.0,False,False,False,https://api.github.com/repos/Hazrat-Ali9/Artificial-Intelligence/contributors,https://api.github.com/repos/Hazrat-Ali9/Artificial-Intelligence/collaborators{/collaborator},1,edge ai
easy-business-ai,Shiinama/easy-business-ai,https://github.com/Shiinama/easy-business-ai,A minimal and cutting-edge AI project template for validating business ideas,49,2025-04-18T05:59:43Z,0,26,False,2,TypeScript,541,1.0,False,False,False,https://api.github.com/repos/Shiinama/easy-business-ai/contributors,https://api.github.com/repos/Shiinama/easy-business-ai/collaborators{/collaborator},0,edge ai
Low-latency-AI-Voice-Assistant,Ankur2606/Low-latency-AI-Voice-Assistant,https://github.com/Ankur2606/Low-latency-AI-Voice-Assistant,"End-to-End AI Voice Assistant pipeline with Whisper for Speech-to-Text, Hugging Face LLM for response generation, and Edge-TTS for Text-to-Speech. Features include Voice Activity Detection (VAD), tunable parameters for pitch, gender, and speed, and real-time response with latency optimization.",10,2025-03-03T19:16:05Z,7,26,False,4,Jupyter Notebook,48,1.0,False,False,False,https://api.github.com/repos/Ankur2606/Low-latency-AI-Voice-Assistant/contributors,https://api.github.com/repos/Ankur2606/Low-latency-AI-Voice-Assistant/collaborators{/collaborator},2,edge ai
smythos-studio,SmythOS/smythos-studio,https://github.com/SmythOS/smythos-studio,"SmythOS Studio: Open-Source Visual AI Agent Builder and deployable runtime stack from SmythOS. Start with an intuitive drag-and-drop workspace, extend with custom code, and deploy your agents anywhere — local, cloud, or edge — with full governance and control.",1162,2025-11-14T14:30:33Z,0,26,False,11,TypeScript,49723,1.0,False,False,False,https://api.github.com/repos/SmythOS/smythos-studio/contributors,https://api.github.com/repos/SmythOS/smythos-studio/collaborators{/collaborator},11,edge ai
Generative-AI-Engineer,Hazrat-Ali9/Generative-AI-Engineer,https://github.com/Hazrat-Ali9/Generative-AI-Engineer,⚽ A cutting ⚾ edge 🥎 mastering 🏀 Generative 🏐 AI your 🏈 complete 🏉 engineering 🎮 toolkit 🎳 building ⛸ intelligent 🚂 creative 🕌 and adaptive 🏩 systems 🚎 using 🚝 state of the ✈ art models 🛬 synthesis 🚀 with 🚟 Tacotron 🛸 WaveNet 🚁 and more AI 🛼 Blog Writer 🚚 Meme 🍔 Generator 🍋 AI 🍎 Powered 🍏 Designer 🥙,1,2025-07-18T09:40:17Z,0,26,False,0,,4,1.0,False,False,False,https://api.github.com/repos/Hazrat-Ali9/Generative-AI-Engineer/contributors,https://api.github.com/repos/Hazrat-Ali9/Generative-AI-Engineer/collaborators{/collaborator},1,edge ai
edgecd-blog,jiangsi/edgecd-blog,https://github.com/jiangsi/edgecd-blog,"EdgeCD AI Blog is an open-source blog system built with Remix.run on Cloudflare Workers. Features: - Powered by Remix.run framework - Fully edge-based computing - Leverages Cloudflare ecosystem (D1, R2, AI, KV, CDN)",2,2024-11-27T16:00:28Z,2,25,False,3,TypeScript,361,1.0,False,False,False,https://api.github.com/repos/jiangsi/edgecd-blog/contributors,https://api.github.com/repos/jiangsi/edgecd-blog/collaborators{/collaborator},1,edge ai
Eye-Cancer-AI-Model,xaanyaax/Eye-Cancer-AI-Model,https://github.com/xaanyaax/Eye-Cancer-AI-Model,"👁️ Eye Cancer Detection Model 🔬🧠 An AI-powered deep learning model that detects cancer cells in the eye from medical images with high precision. 🚀 Built using PyTorch and cutting-edge segmentation techniques, this project delivers real-time predictions through a fully deployed FastAPI backend and a sleek React frontend.",35,2025-08-07T18:14:52Z,0,25,False,5,JavaScript,4485,1.0,False,False,False,https://api.github.com/repos/xaanyaax/Eye-Cancer-AI-Model/contributors,https://api.github.com/repos/xaanyaax/Eye-Cancer-AI-Model/collaborators{/collaborator},1,edge ai
Pose2Art,MauiJerry/Pose2Art,https://github.com/MauiJerry/Pose2Art,Pose2Art creates an AI Camera run on small 'edge' device that extract Pose and sends tracked points via OSC to TouchDesigner and Unity/UnReal for ART!,52,2025-08-06T09:46:55Z,0,25,False,3,Python,50903,1.0,False,False,False,https://api.github.com/repos/MauiJerry/Pose2Art/contributors,https://api.github.com/repos/MauiJerry/Pose2Art/collaborators{/collaborator},2,edge ai
